{
  "id": "leadership",
  "region": "common",
  "rev": 1,
  "name": "Leadership",
  "gdd": [
    "5a.2; 5a.2a"
  ],
  "authoring_status": "specified",
  "missing_fields": [],
  "officer_ids": [
    "elsie"
  ],
  "template_kinds": [
    "expedition_planning"
  ],
  "rank_thresholds": [
    10,
    25,
    45,
    70,
    100
  ],
  "rank_cap": 5,
  "eurydica_cap": 2,
  "points_by_grade": {
    "d": 1,
    "c": 2,
    "b": 3,
    "a": 4,
    "s": 5
  },
  "dialogue_points": 2,
  "per_rank_effects": [
    {
      "op": "add",
      "target": "morale_loss_reduction_fraction",
      "value": 0.1,
      "duration_actions": null
    }
  ],
  "rank_three_unlock": "word_of_encouragement",
  "session_seconds": 3600,
  "session_effects": [
    {
      "op": "set",
      "target": "briefed_start_meter",
      "value": 10,
      "duration_actions": null
    },
    {
      "op": "set",
      "target": "briefed_s_start_meter",
      "value": 15,
      "duration_actions": null
    }
  ]
}
